{
  "composition": {
    "three_dimensional_exact": true,
    "three_dimensional_max_error": 1.1102230246251565e-16,
    "tolerance": 1e-05,
    "two_dimensional_exact": true,
    "two_dimensional_max_error": 1.1102230246251565e-16
  },
  "observer_only": true,
  "projection_id": "philosophy-rhetoric-v0-all-spatial-shadow4-v1",
  "schema_version": 1,
  "three_dimensional": [
    {
      "dimensions": 3,
      "dropped_axes": [
        "x"
      ],
      "kept_axes": [
        "y",
        "z",
        "w"
      ],
      "observer_id": "drop-x",
      "vectors": [
        {
          "node_id": "control.p-authority-proof",
          "values": [
            -0.114096517,
            1.289432136,
            0.034704299
          ]
        },
        {
          "node_id": "control.p-counterfactual-observation",
          "values": [
            0.190160108,
            1.260094711,
            0.016124339
          ]
        },
        {
          "node_id": "control.p-false-consensus",
          "values": [
            0.507161075,
            1.241233528,
            0.006689186
          ]
        },
        {
          "node_id": "control.p-is-ought",
          "values": [
            0.083768224,
            1.262129002,
            0.01673059
          ]
        },
        {
          "node_id": "control.p-label-fallacy",
          "values": [
            0.139792893,
            1.256682939,
            0.014451259
          ]
        },
        {
          "node_id": "control.p-model-reality",
          "values": [
            0.164755367,
            1.259698789,
            0.01578534
          ]
        },
        {
          "node_id": "control.p-position-fact",
          "values": [
            0.383947732,
            1.234167021,
            0.000121889
          ]
        },
        {
          "node_id": "control.r-audience-effect",
          "values": [
            -0.22013685,
            1.297877492,
            -0.016458175
          ]
        },
        {
          "node_id": "control.r-context-erasure",
          "values": [
            -0.030415289,
            1.317809497,
            -0.000315621
          ]
        },
        {
          "node_id": "control.r-ethos-authority",
          "values": [
            -0.086380256,
            1.30084503,
            -0.012703433
          ]
        },
        {
          "node_id": "control.r-intent-mindread",
          "values": [
            -0.075115794,
            1.290906985,
            -0.018653069
          ]
        },
        {
          "node_id": "control.r-omission-invention",
          "values": [
            0.156519513,
            1.270882851,
            -0.03097131
          ]
        },
        {
          "node_id": "control.r-pathos-false",
          "values": [
            0.157827183,
            1.267052668,
            -0.034315433
          ]
        },
        {
          "node_id": "control.r-persuasion-truth",
          "values": [
            -0.125025669,
            1.299428993,
            -0.014010341
          ]
        },
        {
          "node_id": "control.r-propaganda-label",
          "values": [
            0.170333088,
            1.276430482,
            -0.026588349
          ]
        },
        {
          "node_id": "p.abductive-explanation",
          "values": [
            0.381441808,
            -0.055160556,
            -0.00284429
          ]
        },
        {
          "node_id": "p.aesthetics",
          "values": [
            0.095159502,
            -0.000441003,
            0.033227981
          ]
        },
        {
          "node_id": "p.ambiguity",
          "values": [
            -0.049543518,
            -0.036526557,
            0.006691075
          ]
        },
        {
          "node_id": "p.analogy",
          "values": [
            0.090874697,
            -0.035851023,
            0.008370482
          ]
        },
        {
          "node_id": "p.assumption",
          "values": [
            -0.0347826,
            -0.033187591,
            0.007764201
          ]
        },
        {
          "node_id": "p.bayesian-update",
          "values": [
            -0.371207466,
            0.002324217,
            0.030850568
          ]
        },
        {
          "node_id": "p.burden",
          "values": [
            -0.074922561,
            -0.030099057,
            0.011252345
          ]
        },
        {
          "node_id": "p.causal-claim",
          "values": [
            0.367970673,
            -0.036422879,
            0.010553441
          ]
        },
        {
          "node_id": "p.claim",
          "values": [
            -0.277641907,
            -0.019887694,
            0.015400273
          ]
        },
        {
          "node_id": "p.comparative",
          "values": [
            0.256050342,
            -0.023946384,
            0.01862184
          ]
        },
        {
          "node_id": "p.conclusion",
          "values": [
            0.22823694,
            -0.079149042,
            -0.022307893
          ]
        },
        {
          "node_id": "p.consequence",
          "values": [
            0.195790424,
            -0.031815642,
            0.011635577
          ]
        },
        {
          "node_id": "p.consistency",
          "values": [
            0.053635827,
            -0.054763943,
            -0.005337106
          ]
        },
        {
          "node_id": "p.counterexample",
          "values": [
            -0.161346854,
            -0.022182211,
            0.014943679
          ]
        },
        {
          "node_id": "p.counterfactual",
          "values": [
            0.165364619,
            -0.029437595,
            0.013659024
          ]
        },
        {
          "node_id": "p.dialectic",
          "values": [
            0.006392232,
            -0.029678035,
            0.011811165
          ]
        },
        {
          "node_id": "p.disagreement",
          "values": [
            -0.216908803,
            -0.01876553,
            0.017330756
          ]
        },
        {
          "node_id": "p.duty",
          "values": [
            0.284527411,
            -0.03221273,
            0.012495294
          ]
        },
        {
          "node_id": "p.entailment",
          "values": [
            0.052421827,
            -0.056688685,
            -0.007735919
          ]
        },
        {
          "node_id": "p.equivocation",
          "values": [
            0.012718872,
            -0.02631092,
            0.014406699
          ]
        },
        {
          "node_id": "p.example.epistemic-disagreement",
          "values": [
            -0.457262028,
            0.016985159,
            0.039975013
          ]
        },
        {
          "node_id": "p.example.mind-thought-experiment",
          "values": [
            0.205048581,
            -0.028153844,
            0.015151261
          ]
        },
        {
          "node_id": "p.existential",
          "values": [
            0.139026798,
            -0.024391469,
            0.016535002
          ]
        },
        {
          "node_id": "p.explanation",
          "values": [
            0.259712074,
            -0.037072046,
            0.008340457
          ]
        },
        {
          "node_id": "p.fallacy",
          "values": [
            -0.101197638,
            -0.029449766,
            0.011244032
          ]
        },
        {
          "node_id": "p.humility",
          "values": [
            -0.198710435,
            -0.012522745,
            0.02132609
          ]
        },
        {
          "node_id": "p.hypothesis",
          "values": [
            0.090001203,
            -0.040855667,
            0.003748153
          ]
        },
        {
          "node_id": "p.identity",
          "values": [
            -0.065025381,
            0.013123557,
            0.04168412
          ]
        },
        {
          "node_id": "p.inductive-support",
          "values": [
            -0.138715705,
            -0.025049946,
            0.013509301
          ]
        },
        {
          "node_id": "p.inference",
          "values": [
            -0.086764062,
            -0.039571794,
            0.002603013
          ]
        },
        {
          "node_id": "p.justification",
          "values": [
            -0.026831178,
            -0.039321168,
            0.003987434
          ]
        },
        {
          "node_id": "p.language",
          "values": [
            0.544717693,
            -0.046725374,
            0.005460236
          ]
        },
        {
          "node_id": "p.law",
          "values": [
            0.645094673,
            -0.054221937,
            0.001331249
          ]
        },
        {
          "node_id": "p.mathematics",
          "values": [
            0.633057344,
            -0.057049192,
            -0.00082103
          ]
        },
        {
          "node_id": "p.metaphysics",
          "values": [
            -0.149727486,
            0.017507321,
            0.044002658
          ]
        },
        {
          "node_id": "p.mind",
          "values": [
            0.643865419,
            -0.054480233,
            0.001029599
          ]
        },
        {
          "node_id": "p.model",
          "values": [
            0.11177696,
            -0.029077855,
            0.013074554
          ]
        },
        {
          "node_id": "p.moral-uncertainty",
          "values": [
            -0.024536366,
            -0.0097147,
            0.025008862
          ]
        },
        {
          "node_id": "p.phenomenology",
          "values": [
            -0.068270155,
            -0.00115496,
            0.031477241
          ]
        },
        {
          "node_id": "p.political",
          "values": [
            0.5304596,
            -0.038796793,
            0.010112466
          ]
        },